{
  "record_type": "destruction_attestation",
  "attestation_id": "018f5c3e-7b00-7000-8000-000000000621",
  "attestation_version": 1,
  "workspace_id": "018f5c3e-7b00-7000-8000-000000000622",
  "lifecycle_revision": 3,
  "plan_id": "018f5c3e-7b00-7000-8000-000000000623",
  "plan_digest": "sha256:bbbbbbbbbbbbbbbbbbbbbbbbbbbbbbbbbbbbbbbbbbbbbbbbbbbbbbbbbbbbbbbb",
  "retention_profile": {"key": "retention.synthetic", "version": "0.1.0"},
  "basis_registry": {"key": "basis.synthetic", "version": "0.1.0"},
  "basis_code": "SYNTHETIC_TEST_DISPOSAL",
  "legal_hold_check_ids": ["018f5c3e-7b00-7000-8000-000000000624"],
  "requester_identity_id": "human.synthetic.requester",
  "confirmer_identity_id": "human.synthetic.confirmer",
  "executor_identity_id": "service.synthetic.executor",
  "verifier_identity_id": "human.synthetic.verifier",
  "adapter_registry": {"key": "adapters.synthetic", "version": "0.1.0"},
  "receipt_ids": ["018f5c3e-7b00-7000-8000-000000000625"],
  "scan_ids": ["018f5c3e-7b00-7000-8000-000000000626"],
  "aggregate_deleted_count": 1,
  "aggregate_residue_count": 0,
  "residue_classes": [],
  "platform_integrity_before": "sha256:aaaaaaaaaaaaaaaaaaaaaaaaaaaaaaaaaaaaaaaaaaaaaaaaaaaaaaaaaaaaaaaa",
  "platform_integrity_after": "sha256:aaaaaaaaaaaaaaaaaaaaaaaaaaaaaaaaaaaaaaaaaaaaaaaaaaaaaaaaaaaaaaaa",
  "verified_at": "2026-08-23T00:00:00Z",
  "assurance_class": "development/disposable",
  "outcome": "verified"
}
